{
  "catalog_id": "ineos-sarralbe-payroll-rules-v1",
  "version": "1.1.0",
  "scope": "Socle V1.1 remuneration, temps de travail et conges INEOS Sarralbe - non connecte au moteur Nexus",
  "security_notice": "Catalogue structurel sans bulletin nominatif et sans document prive. Les sources exactes doivent etre rattachees avant calcul ou usage opposable.",
  "rules": [
    {
      "rule_id": "WT_5X8_JOURS_DUS_001",
      "title": "Jours dus 5x8 apres negociation",
      "description": "Pour l'organisation 5x8, l'information metier indique 11 jours dus apres negociation, dans un contexte de 190 postes theoriques et 178 postes de roulement.",
      "source_layer": "accord_entreprise",
      "document_type": "source_metier_a_rattacher",
      "source_document": "Information metier V1.1 a rattacher a l'accord ou avenant INEOS applicable au 5x8",
      "source_page": null,
      "source_chunk_id": "mission-v1-1:wt-5x8-jours-dus",
      "source_date": null,
      "effective_date": null,
      "end_date": null,
      "supersedes": [],
      "superseded_by": [],
      "status": "to_verify",
      "historical_only": false,
      "confidentiality": "internal",
      "confidence": "medium",
      "payroll_topic": ["repos_compensateur"],
      "leave_topic": ["rtt"],
      "work_time_topic": ["5x8", "poste_continu", "roulement", "repos"],
      "employee_population": ["personnel_poste", "poste_continu"],
      "employment_category": ["tous"],
      "work_schedule": ["5x8", "poste_continu", "roulement"],
      "site": "INEOS Sarralbe",
      "conditions": ["Organisation 5x8", "Regle a rattacher au texte source avant usage"],
      "exclusions": [],
      "required_variables": ["annee_de_reference", "poste_theoriques", "postes_roulement", "compteurs_kelio"],
      "calculation_formula": {
        "expression": "Calcul desactive Lot 1. Valeur metier a verifier: 11 jours dus.",
        "source_refs": ["mission-v1-1:wt-5x8-jours-dus"],
        "sourced_values": [
          {
            "label": "jours dus",
            "value": "11 jours",
            "source": "Information metier V1.1",
            "status": "to_verify"
          }
        ],
        "limitations": ["Ne pas calculer tant que l'accord source et la periode d'application ne sont pas rattaches."]
      },
      "calculation_allowed": false,
      "benefit_or_obligation": "compteur",
      "payroll_lines_to_check": [],
      "kelio_counters": ["jours_dus", "JR", "RJFJ", "RJFN"],
      "legal_priority": "to_verify",
      "notes": ["Regle structurelle du 5x8, a confirmer par l'accord ou avenant source."],
      "validation_status": "source_to_attach"
    },
    {
      "rule_id": "WT_5X8_RCTP_001",
      "title": "RCTP 5x8",
      "description": "L'information metier indique un compteur RCTP de 3 jours pour l'organisation 5x8.",
      "source_layer": "accord_entreprise",
      "document_type": "source_metier_a_rattacher",
      "source_document": "Information metier V1.1 a rattacher au texte INEOS applicable au RCTP",
      "source_page": null,
      "source_chunk_id": "mission-v1-1:wt-5x8-rctp",
      "source_date": null,
      "effective_date": null,
      "end_date": null,
      "supersedes": [],
      "superseded_by": [],
      "status": "to_verify",
      "historical_only": false,
      "confidentiality": "internal",
      "confidence": "medium",
      "payroll_topic": ["repos_compensateur"],
      "leave_topic": ["rtt"],
      "work_time_topic": ["5x8", "poste_continu", "repos"],
      "employee_population": ["personnel_poste", "poste_continu"],
      "employment_category": ["tous"],
      "work_schedule": ["5x8", "poste_continu"],
      "site": "INEOS Sarralbe",
      "conditions": ["Organisation 5x8", "Rattachement documentaire requis"],
      "exclusions": [],
      "required_variables": ["annee_de_reference", "compteur_RCTP"],
      "calculation_formula": {
        "expression": "Calcul desactive Lot 1. Valeur metier a verifier: RCTP = 3 jours.",
        "source_refs": ["mission-v1-1:wt-5x8-rctp"],
        "sourced_values": [
          {
            "label": "RCTP",
            "value": "3 jours",
            "source": "Information metier V1.1",
            "status": "to_verify"
          }
        ],
        "limitations": ["Compteur a confirmer dans la source INEOS."]
      },
      "calculation_allowed": false,
      "benefit_or_obligation": "compteur",
      "payroll_lines_to_check": [],
      "kelio_counters": ["RCTP"],
      "legal_priority": "to_verify",
      "notes": ["Ne pas confondre RCTP, RCTR, RJFJ, RJFN et JR."],
      "validation_status": "source_to_attach"
    },
    {
      "rule_id": "WT_5X8_RCTR_001",
      "title": "RCTR 5x8",
      "description": "L'information metier indique un compteur RCTR de 2 jours pour l'organisation 5x8.",
      "source_layer": "accord_entreprise",
      "document_type": "source_metier_a_rattacher",
      "source_document": "Information metier V1.1 a rattacher au texte INEOS applicable au RCTR",
      "source_page": null,
      "source_chunk_id": "mission-v1-1:wt-5x8-rctr",
      "source_date": null,
      "effective_date": null,
      "end_date": null,
      "supersedes": [],
      "superseded_by": [],
      "status": "to_verify",
      "historical_only": false,
      "confidentiality": "internal",
      "confidence": "medium",
      "payroll_topic": ["repos_compensateur"],
      "leave_topic": ["rtt"],
      "work_time_topic": ["5x8", "poste_continu", "repos"],
      "employee_population": ["personnel_poste", "poste_continu"],
      "employment_category": ["tous"],
      "work_schedule": ["5x8", "poste_continu"],
      "site": "INEOS Sarralbe",
      "conditions": ["Organisation 5x8", "Rattachement documentaire requis"],
      "exclusions": [],
      "required_variables": ["annee_de_reference", "compteur_RCTR"],
      "calculation_formula": {
        "expression": "Calcul desactive Lot 1. Valeur metier a verifier: RCTR = 2 jours.",
        "source_refs": ["mission-v1-1:wt-5x8-rctr"],
        "sourced_values": [
          {
            "label": "RCTR",
            "value": "2 jours",
            "source": "Information metier V1.1",
            "status": "to_verify"
          }
        ],
        "limitations": ["Compteur a confirmer dans la source INEOS."]
      },
      "calculation_allowed": false,
      "benefit_or_obligation": "compteur",
      "payroll_lines_to_check": [],
      "kelio_counters": ["RCTR"],
      "legal_priority": "to_verify",
      "notes": ["Ne pas confondre RCTR et RCTP."],
      "validation_status": "source_to_attach"
    },
    {
      "rule_id": "WT_5X8_RJFJ_TO_JR_001",
      "title": "Prelevement RJFJ vers JR",
      "description": "L'information metier indique un prelevement de 6 jours sur RJFJ vers JR.",
      "source_layer": "accord_entreprise",
      "document_type": "source_metier_a_rattacher",
      "source_document": "Information metier V1.1 a rattacher au texte INEOS applicable aux compteurs RJFJ et JR",
      "source_page": null,
      "source_chunk_id": "mission-v1-1:wt-5x8-rjfj-jr",
      "source_date": null,
      "effective_date": null,
      "end_date": null,
      "supersedes": [],
      "superseded_by": [],
      "status": "to_verify",
      "historical_only": false,
      "confidentiality": "internal",
      "confidence": "medium",
      "payroll_topic": ["repos_compensateur"],
      "leave_topic": ["recuperation_jour_ferie"],
      "work_time_topic": ["5x8", "poste_continu", "repos"],
      "employee_population": ["personnel_poste", "poste_continu"],
      "employment_category": ["tous"],
      "work_schedule": ["5x8", "poste_continu"],
      "site": "INEOS Sarralbe",
      "conditions": ["Organisation 5x8", "Prelevement annuel a verifier"],
      "exclusions": [],
      "required_variables": ["compteur_RJFJ_avant", "compteur_JR_avant", "date_regularisation"],
      "calculation_formula": {
        "expression": "Calcul desactive Lot 1. Valeur metier a verifier: transfert de 6 jours RJFJ vers JR.",
        "source_refs": ["mission-v1-1:wt-5x8-rjfj-jr"],
        "sourced_values": [
          {
            "label": "prelevement RJFJ vers JR",
            "value": "6 jours",
            "source": "Information metier V1.1",
            "status": "to_verify"
          }
        ],
        "limitations": ["Aucune ecriture de compteur ne doit etre automatisee dans ce lot."]
      },
      "calculation_allowed": false,
      "benefit_or_obligation": "compteur",
      "payroll_lines_to_check": [],
      "kelio_counters": ["RJFJ", "JR"],
      "legal_priority": "to_verify",
      "notes": ["A valider avec les compteurs Kelio et la source INEOS."],
      "validation_status": "source_to_attach"
    },
    {
      "rule_id": "WT_5X8_JR_REGULARISATION_001",
      "title": "Regularisation JR avant le 31 janvier",
      "description": "L'information metier indique une regularisation JR avant le 31 janvier.",
      "source_layer": "accord_entreprise",
      "document_type": "source_metier_a_rattacher",
      "source_document": "Information metier V1.1 a rattacher au texte INEOS applicable aux JR",
      "source_page": null,
      "source_chunk_id": "mission-v1-1:wt-5x8-jr-regularisation",
      "source_date": null,
      "effective_date": null,
      "end_date": null,
      "supersedes": [],
      "superseded_by": [],
      "status": "to_verify",
      "historical_only": false,
      "confidentiality": "internal",
      "confidence": "medium",
      "payroll_topic": ["repos_compensateur"],
      "leave_topic": ["recuperation_jour_ferie"],
      "work_time_topic": ["5x8", "poste_continu", "repos"],
      "employee_population": ["personnel_poste", "poste_continu"],
      "employment_category": ["tous"],
      "work_schedule": ["5x8", "poste_continu"],
      "site": "INEOS Sarralbe",
      "conditions": ["Regularisation avant le 31 janvier", "Annee de reference a confirmer"],
      "exclusions": [],